expected semantic name,input,correct/incorrect,not_correct_segment,correct_segment_v2,correct_segment_v3,no_idx_in_semantic
ไม่ได้รับเอกสาร,ส่งเอกสารมายังนานแล้วนะ ยังไม่ได้รับเอกสารเลย,yes,ส่ง เอกสาร มายัง นาน แล้ว นะ ยัง ไม่ ได้รับ เอกสาร เลย,ส่ง เอกสาร มายัง นาน แล้ว นะ ยัง ไม่ ได้รับ เอกสาร เลย,ส่ง เอกสาร มายัง นาน แล้ว นะ ยัง ไม่ ได้รับ เอกสาร เลย,5
สอบถามการ claim ประกัน,อยากได้เบอร์ติดต่อแผนกเคลมประกัน,no,อยาก ได้ เบอร์ ติดต่อ แผนก เคลม ประกัน,อยาก ได้ เบอร์ ติดต่อ แผนก เคลม ประกัน,อยาก ได้ เบอร์ ติดต่อ แผนก เคลม ประกัน,6
ข้อมูลผลิตภัณฑ์ประเภทประกัน,ต้องการข้อมูลลายละเอียดประกันของธนคารกรุงศรี,yes,ต้องการ ข้อมูล ลาย ละเอียด ประกัน ของ ธน คาร กรุงศรี,ต้องการ ข้อมูล รายละเอียด ประกัน ของ ธนาคาร กรุงศรี,ต้องการ ข้อมูล รายละเอียด ประกัน ของ ธนาคาร กรุงศรี,6
สอบถามค่าธรรมเนียม,สินเชื่อคอนโดมีค่าธรรมเนียมเท่าไหร่,yes,สินเชื่อ คอนโด มีค่า ธรรมเนียม เท่าไหร่,สินเชื่อ คอนโด มีค่า ธรรมเนียม เท่าไหร่,สินเชื่อ คอนโด มีค่า ธรรมเนียม เท่าไหร่,6
สอบถามการโอนเงินไปต่างประเทศ,โอนเงินไป ตปท มีวิธีไหนคุ้มสุด ดีสุด เร็วสุด,no,โอนเงิน ไป ต ปท มี วิธี ไหน คุ้ม สุด ดี สุด เร็ว สุด,โอนเงิน ไป ต่างประเทศ มี วิธี ไหน คุ้ม สุด ดี สุด เร็ว สุด,โอนเงิน ไป ต่างประเทศ มี วิธี ไหน คุ้ม สุด ดี สุด เร็ว สุด,6
สอบถามการเปิดบัญชี,บัญชีออมทรัพย์ เงินขั้นต่ำต้องมีกี่บาท,no,บัญชี ออมทรัพย์ เงิน ขั้นต่ำ ต้อง มี กี่ บาท,บัญชี ออมทรัพย์ เงิน ขั้นต่ำ ต้อง มี กี่ บาท,บัญชี ออมทรัพย์ เงิน ขั้นต่ำ ต้อง มี กี่ บาท,6
สอบถามการสมัคร promptpay,ลงทะเบียนสมัครพร้อมเพย์ได้ยังไงบ้าง,yes,ลงทะเบียน สมัคร พร้อม เพย์ ได้ ยังไง บ้าง,ลงทะเบียน สมัคร promptpay ได้ ยังไง บ้าง,ลงทะเบียน สมัคร promptpay ได้ ยังไง บ้าง,6
สอบถามข้อมูลสาขา,เขตบางคอแหลม สาขากรุงศรีมีที่ไหนบ้าง,yes,เขตบางคอแหลม สาขา กรุงศรี มี ที่ไหนบ้าง,เขตบางคอแหลม สาขา กรุงศรี มี ที่ไหนบ้าง,เขตบางคอแหลม สาขา กรุงศรี มี ที่ไหนบ้าง,6
ไถ่ถอนหลักประกัน,ไถ่ถอนบ้านจากธนาคารต้องเสียค่าใช้จ่ายอะไรบ้าง ?,yes,ไถ่ถอน บ้าน จาก ธนาคาร ต้อง เสียค่าใช้จ่าย อะไร บ้าง ?,ไถ่ถอน บ้าน จาก ธนาคาร ต้อง เสียค่าใช้จ่าย อะไรบ้าง ?,ไถ่ถอน บ้าน จาก ธนาคาร ต้อง เสียค่าใช้จ่าย อะไรบ้าง ?,6
ร้องเรียนบริการ,พนง ทำงานไม่ดี บริการแย่ ไม่ใส่ใจ แถมด่าลูกค้า มีที่รับร้องเรียนมั้ย,yes,พ นง ทำงาน ไม่ดี บริการ แย่ ไม่ ใส่ใจ แถม ด่า ลูกค้า มี ที่ รับ ร้องเรียน ม ั ้ ย,พนักงาน ทำงาน ไม่ดี บริการ แย่ ไม่ ใส่ใจ แถม ด่า ลูกค้า มี ที่ รับ ร้องเรียน ไหม,พนักงาน ทำงาน ไม่ดี บริการ แย่ ไม่ ใส่ใจ แถม ด่า ลูกค้า มี ที่ รับ ร้องเรียน ไหม,6
ตรวจสอบสถานะการจัดส่งบัตร,อยากสอบถามสถานะการจัดส่งบัตรเดบิต all atms ครับ,yes,อยาก สอบถาม สถานะ การจัดส่ง บัตรเดบิต all atms ครับ,อยาก สอบถาม สถานะ การจัดส่ง บัตรเดบิต all atm ครับ,อยาก สอบถาม สถานะ การจัดส่ง บัตรเดบิต all atm ครับ,6
ต้องการหนังสือรับรองการหักภาษี ณ ที่จ่าย,เอกสารที่ต้องใช้ในการขอหนังสือรับรองหักภาษี,yes,เอกสาร ที่ ต้อง ใช้ ใน การ ขอ หนังสือรับรอง หัก ภาษี,เอกสาร ที่ ต้อง ใช้ ใน การ ขอ หนังสือรับรอง หัก ภาษี,เอกสาร ที่ ต้อง ใช้ ใน การ ขอ หนังสือรับรอง หัก ภาษี,6
สมัครงาน,อยากเป็นพนักงานสาขา ต้องสมัครยังคะ,no,อยาก เป็น พนักงาน สาขา ต้อง สมัคร ยัง คะ,อยาก เป็น พนักงาน สาขา ต้อง สมัคร ยัง คะ,อยาก เป็น พนักงาน สาขา ต้อง สมัคร ยัง คะ,6
แจ้งสมุดบัญชีหาย,สมุดบัญชีหาย แต่ไม่สะดวกติดต่อเอง ให้แม่ติดต่อทำสมุดเล่มใหม่แทนได้ไหมคะ,no,สมุดบัญชี หาย แต่ ไม่ สะดวก ติดต่อ เอง ให้ แม่ ติดต่อ ทำ สมุด เล่ม ใหม่ แทน ได้ไหม คะ,สมุดบัญชี หาย แต่ ไม่ สะดวก ติดต่อ เอง ให้ แม่ ติดต่อ ทำ สมุด เล่ม ใหม่ แทนได้ ไหมคะ,สมุดบัญชี หาย แต่ ไม่ สะดวก ติดต่อ เอง ให้ แม่ ติดต่อ ทำ สมุด เล่ม ใหม่ แทนได้ ไหมคะ,6
สิทธิขั้นพื้นฐานผู้บริโภค,ทำไมข้อมูลที่โฆษณา ไม่ตรงกับความเป็นจริง,no,ทำไม ข้อมูล ที่ โฆษณา ไม่ ตรง กับ ความเป็นจริง,ทำไม ข้อมูล ที่ โฆษณา ไม่ ตรง กับ ความเป็นจริง,ทำไม ข้อมูล ที่ โฆษณา ไม่ ตรง กับ ความเป็นจริง,6
คุณสมบัติผู้สมัคร,อยากมีร้านกาแฟอายุ 28 กู้ได้ประมาณกี่บาทค่ะ,no,อยาก มี ร้านกาแฟ อายุ ## กู้ ได้ ประมาณ กี่ บาท ค่ะ,อยาก มี ร้านกาแฟ อายุ ## กู้ได้ ประมาณ กี่ บาท ค่ะ,อยาก มี ร้านกาแฟ อายุ ## กู้ได้ ประมาณ กี่ บาท ค่ะ,6
แจ้งปัญหาการ login,kma มีปัญหาไหม ทำไม่ login ไม่ได้,no,kma มีปัญหา ไหม ทำ ไม่ login ไม่ได้,kma มีปัญหา ไหม ทำ ไม่ login ไม่ได้,kma มีปัญหา ไหม ทำ ไม่ login ไม่ได้,6
บัตรหมดอายุ,บัตร atm หมดอายุได้ไหม,no,บัตร atm หมดอายุ ได้ไหม,บัตร atm หมดอายุ ได้ไหม,บัตร atm หมดอายุ ได้ไหม,6
เปลี่ยนแปลงหมายเลขโทรศัพท์,เปลี่ยนเบอร์โทรศัพท์ ที่ kma ได้ไหม,yes,เปลี่ยน เบอร์โทรศัพท์ ที่ kma ได้ไหม,เปลี่ยน เบอร์โทรศัพท์ ที่ kma ได้ไหม,เปลี่ยน เบอร์โทรศัพท์ ที่ kma ได้ไหม,6
เปลี่ยนแปลงหมายเลขโทรศัพท์รับ otp,otp ส่งไปที่เบอร์เก่า แก้ไขยังไง,yes,otp ส่ง ไปที่ เบอร์ เก่า แก้ไข ยังไง,otp ส่ง ไปที่ เบอร์ เก่า แก้ไข ยังไง,otp ส่ง ไปที่ เบอร์ เก่า แก้ไข ยังไง,6
สอบถาม cheque clearing,รับเช็คช่วงบ่ายสาม ได้เงินวันไหน,yes,รับ เช็ค ช่วง บ่ายสาม ได้ เงิน วัน ไหน,รับ เช็ค ช่วง บ่ายสาม ได้ เงิน วัน ไหน,รับ เช็ค ช่วง บ่ายสาม ได้ เงิน วัน ไหน,6
สอบถาม cheque,สอบถามสถานะเช็ค,yes,สอบถาม สถานะ เช็ค,สอบถาม สถานะ เช็ค,สอบถาม สถานะ เช็ค,6
ตรวจสอบสถานะการสมัคร,ยื่นกู้ไปหลายวันแล้ว ตามผลยังไง,no,ยื่น กู้ ไป หลาย วัน แล้ว ตาม ผล ยังไง,ยื่น กู้ ไป หลาย วัน แล้ว ตาม ผล ยังไง,ยื่น กู้ ไป หลาย วัน แล้ว ตาม ผล ยังไง,6
เจ้าของบัญชีเสียชีวิต,บัญชีธนาคาร ของคนที่เสียชีวิตแล้ว สามารถปิดได้ไหม,yes,บัญชี ธนาคาร ของ คนที่ เสียชีวิต แล้ว สามารถ ปิด ได้ไหม,บัญชี ธนาคาร ของ คนที่ เสียชีวิต แล้ว สามารถ ปิด ได้ไหม,บัญชี ธนาคาร ของ คนที่ เสียชีวิต แล้ว สามารถ ปิด ได้ไหม,6
ติดต่อ admin,ไม่อยากคุยกับไอ้หมีบ้าแล้ว เอาคนมาคุย,yes,ไม่อยาก คุย กับ ไอ้ หมี บ้า แล้ว เอา คน มา คุย,ไม่อยาก คุย กับ ไอ้ หมี บ้า แล้ว เอา คน มา คุย,ไม่อยาก คุย กับ ไอ้ หมี บ้า แล้ว เอา คน มา คุย,6
สอบถามหมายเลขโทรศัพท์ call center,call center กรุงศรีเบอร์อะไร?,yes,call center กรุงศรี เบอร์ อะไร ?,call center กรุงศรี เบอร์ อะไร ?,call center กรุงศรี เบอร์ อะไร ?,6
สอบถามค่าธรรมเนียมการออกบัตรใหม่,อยากทำบัตรเดบิตแมนเชสเตอร์ ยูไนเต็ด ต้องเสียค่าธรรมเนียมออกบัตรใหม่ไหม,no,อยาก ทำ บัตรเดบิต แมนเชสเตอร์ ยูไนเต็ด ต้อง เสียค่าธรรมเนียม ออก บัตร ใหม่ ไหม,อยาก ทำ บัตรเดบิต แมนเชสเตอร์ ยูไนเต็ด ต้อง เสียค่าธรรมเนียม ออก บัตร ใหม่ ไหม,อยาก ทำ บัตรเดบิต แมนเชสเตอร์ ยูไนเต็ด ต้อง เสียค่าธรรมเนียม ออก บัตร ใหม่ ไหม,6
ข้อมูลผลิตภัณฑ์ประเภทบัญชี,ขอสอบถามสิทธิประโยชน์บัญชีเงินฝากประจำปลอดภาษี,yes,ขอ สอบถาม สิทธิประโยชน์ บัญชีเงินฝาก ประจำ ปลอด ภาษี,ขอ สอบถาม สิทธิประโยชน์ บัญชีเงินฝาก ประจำ ปลอด ภาษี,ขอ สอบถาม สิทธิประโยชน์ บัญชีเงินฝาก ประจำ ปลอด ภาษี,6
สอบถามค่าธรรมเนียมรายปี,อยากรู้ค่าธรรมเนียมของ saving แต่ละประเภทค่ะ,no,อยากรู้ ค่าธรรมเนียม ของ saving แต่ละ ประเภท ค่ะ,อยากรู้ ค่าธรรมเนียม ของ saving แต่ละ ประเภท ค่ะ,อยากรู้ ค่าธรรมเนียม ของ saving แต่ละ ประเภท ค่ะ,6
สอบถามค่าธรรมเนียมการโอนเงิน,ค่าฟรี/ค่าธรรมเนียม การโอนเงินต่างประเทศ,yes,ค่า ฟรี / ค่าธรรมเนียม การ โอนเงิน ต่างประเทศ,ค่า ฟรี / ค่าธรรมเนียม การ โอนเงิน ต่างประเทศ,ค่า ฟรี / ค่าธรรมเนียม การ โอนเงิน ต่างประเทศ,6
สอบถามยอดเงินในบัญชี,ทำไมดูยอดเงินในบัญชีไม่ได้,yes,ทำไม ดู ยอดเงิน ใน บัญชี ไม่ได้,ทำไม ดู ยอดเงิน ใน บัญชี ไม่ได้,ทำไม ดู ยอดเงิน ใน บัญชี ไม่ได้,6
สอบถามค่าธรรมเนียมเปิดสมุดบัญชีใหม่,การเปิดบัญชีมีการค่าธรรมเนียมหรือไม่,yes,การ เปิดบัญชี มี การ ค่าธรรมเนียม หรือไม่,การ เปิดบัญชี มี การ ค่าธรรมเนียม หรือไม่,การ เปิดบัญชี มี การ ค่าธรรมเนียม หรือไม่,6
สอบถามวงเงินคงเหลือ,ตอนนี้บัตร jcb รูดได้อีกเท่าไร,no,ตอนนี้ บัตร jcb รูด ได้ อีก เท่าไร,ตอนนี้ บัตร jcb รูด ได้ อีก เท่าไร,ตอนนี้ บัตร jcb รูด ได้ อีก เท่าไร,6
สอบถาม swift code,น้องคะ พี่จะโอนเงินให้ลูกสาวที่ ตปท แต่ไม่รู้ swiftcodeต้องติดต่อขอรหัสที่ใครคะ ขอด่วนๆนะคะ พี่รีบ!!!!,no,น้อง คะ พี่ จะ โอนเงิน ให้ ลูกสาว ที่ ต ปท แต่ ไม่รู้ swiftcode ต้อง ติดต่อ ขอ รหัส ที่ ใคร คะ ขอ ด่วน ๆ นะคะ พี่ รีบ !! !!,น้อง คะ พี่ จะ โอนเงิน ให้ ลูกสาว ที่ ต่างประเทศ แต่ ไม่รู้ swiftcode ต้อง ติดต่อ ขอ รหัส ที่ ใคร คะ ขอ ด่วน ๆ นะคะ พี่ รีบ !! !!,น้อง คะ พี่ จะ โอนเงิน ให้ ลูกสาว ที่ ต่างประเทศ แต่ ไม่รู้ swiftcode ต้อง ติดต่อ ขอ รหัส ที่ ใคร คะ ขอ ด่วน ๆ นะคะ พี่ รีบ !! !!,6
สอบถามรหัสประจำตัว,รหัสประจำตัวใช่ user ที่ log in kma ไหม,yes,รหัส ประจำตัว ใช่ user ที่ log in kma ไหม,รหัส ประจำตัว ใช่ user ที่ log in kma ไหม,รหัส ประจำตัว ใช่ user ที่ log in kma ไหม,6
อัตราการแลกเปลี่ยนเงินตราต่างประเทศ,ขอติดต่อสอบถามอัตราแลกเปลี่ยนค่ะ,yes,ขอ ติดต่อสอบถาม อัตรา แลกเปลี่ยน ค่ะ,ขอ ติดต่อสอบถาม อัตรา แลกเปลี่ยน ค่ะ,ขอ ติดต่อสอบถาม อัตรา แลกเปลี่ยน ค่ะ,6
สอบถามการต่อประกัน,ขอรายละเอียดต่ออายุกรมธรรม์ค่ะ,no,ขอ รายละเอียด ต่ออายุ กรมธรรม์ ค่ะ,ขอ รายละเอียด ต่ออายุ กรมธรรม์ ค่ะ,ขอ รายละเอียด ต่ออายุ กรมธรรม์ ค่ะ,6
ลืม account,ลืม username,yes,ลืม username,ลืม username,ลืม username,6
สอบถามเวลาปิดรับ cheque,ขอสอบถาม เวลาปิดรับเช็ค หน่อยค่ะ,yes,ขอ สอบถาม เวลา ปิด รับ เช็ค หน่อย ค่ะ,ขอ สอบถาม เวลา ปิด รับ เช็ค หน่อย ค่ะ,ขอ สอบถาม เวลา ปิด รับ เช็ค หน่อย ค่ะ,6
สอบถามการสมัคร app,สอบถามการสมัคร app,yes,สอบถาม การ สมัคร app,สอบถาม การ สมัคร app,สอบถาม การ สมัคร app,6
สมัคร app,เจ้าหมีๆสอนสมัคร kmaหน่อยสิ,yes,เจ้า หมี ๆ สอน สมัคร kma หน่อย สิ,เจ้า หมี ๆ สอน สมัคร kma หน่อย สิ,เจ้า หมี ๆ สอน สมัคร kma หน่อย สิ,6
สอบถามการติดตั้ง mobile app,จะ download app ของกรุงศรีบนมือถือ ต้องไปที่ไหน,no,จะ download app ของ กรุงศรี บน มือถือ ต้อง ไป ที่ไหน,จะ download app ของ กรุงศรี บน มือถือ ต้อง ไป ที่ไหน,จะ download app ของ กรุงศรี บน มือถือ ต้อง ไป ที่ไหน,6
สอบถามวิธีใช้ app,อยากลบบัญชีใน kma,yes,อยาก ลบ บัญชี ใน kma,อยาก ลบ บัญชี ใน kma,อยาก ลบ บัญชี ใน kma,6
สอบถามหลักประกัน,กู้เงินส่วนบุคคลต้องใช้หลักประกันไหม,yes,กู้เงิน ส่วนบุคคล ต้อง ใช้ หลัก ประกัน ไหม,กู้เงิน ส่วนบุคคล ต้อง ใช้ หลัก ประกัน ไหม,กู้เงิน ส่วนบุคคล ต้อง ใช้ หลักประกัน ไหม,6
สอบถามช่องทางการชำระ,ช่องทางชำระค่างวดประกันมีกี่ช่องทาง,yes,ช่องทาง ชำระ ค่างวด ประกัน มี กี่ ช่องทาง,ช่องทาง ชำระ ค่างวด ประกัน มี กี่ ช่องทาง,ช่องทาง ชำระ ค่างวด ประกัน มี กี่ ช่องทาง,6
เงินในบัญชีหาย,ทำไมเงิน statement ใน app กะ ในสมุดไม่ตรงกันอะค่ะ เหมือนหายไป100 บาทค่ะ,no,ทำไม เงิน statement ใน app กะ ใน สมุด ไม่ ตรงกัน อะ ค่ะ เหมือน หายไป 1## บาท ค่ะ,ทำไม เงิน statement ใน app กับ ใน สมุด ไม่ ตรงกัน อะ ค่ะ เหมือน หายไป 1## บาท ค่ะ,ทำไม เงิน statement ใน app กับ ใน สมุด ไม่ ตรงกัน อะ ค่ะ เหมือน หายไป 1## บาท ค่ะ,6
ไม่ได้รับ otp,จะโอนเงิน แต่ไม่ได้รับ otp,no,จะ โอนเงิน แต่ ไม่ ได้รับ otp,จะ โอนเงิน แต่ ไม่ ได้รับ otp,จะ โอนเงิน แต่ ไม่ ได้รับ otp,6
otp ถูก lock,ระบบแจ้งโอทีพีล็อคค่ะ ต้องทำไงค่ะ,yes,ระบบ แจ้ง โอทีพี ล็อค ค่ะ ต้อง ทำไง ค่ะ,ระบบ แจ้ง otp ล็อค ค่ะ ต้องทำไง ค่ะ,ระบบ แจ้ง otp ล็อค ค่ะ ต้องทำไง ค่ะ,6
สอบถาม promptpay,สิทธิประโยชน์พร้อมเพย์มีอะไรบ้างค่ะ,yes,สิทธิประโยชน์ พร้อม เพย์ มี อะไร บ้าง ค่ะ,สิทธิประโยชน์ promptpay มีอะไรบ้าง ค่ะ,สิทธิประโยชน์ promptpay มีอะไรบ้าง ค่ะ,6
ปัญหาการใช้ app,ทำไมเข้า kma ไม่ได้อะ,yes,ทำไม เข้า kma ไม่ได้ อะ,ทำไม เข้า kma ไม่ได้ อะ,ทำไม เข้า kma ไม่ได้ อะ,6
