expected semantic name,input,correct/incorrect,not_correct_segment,correct_segment_v2,correct_segment_v3,no_idx_in_semantic
ประเภทบัตรเดบิต,อยากทราบบัตรเดบิตที่มีประกันด้วยอะครับ,yes,อยาก ทราบ บัตรเดบิต ที่ มี ประกัน ด้วย อะ ครับ,อยาก ทราบ บัตรเดบิต ที่ มี ประกัน ด้วย อะครับ,อยาก ทราบ บัตรเดบิต ที่ มี ประกัน ด้วย อะครับ,2
ประเภทบัญชีเงินฝาก,ฝากประจำแบบไหนดอกเบี้ยเยอะสุด,yes,ฝากประจำ แบบไหน ดอกเบี้ย เยอะ สุด,ฝากประจำ แบบไหน ดอกเบี้ย เยอะ สุด,ฝากประจำ แบบไหน ดอกเบี้ย เยอะ สุด,2
Krungsri SMS Banking,อยากได้sms แจ้งเตือนเงินเข้าครับ,yes,อยาก ได้ sms แจ้ง เตือน เงิน เข้า ครับ,อยาก ได้ sms แจ้ง เตือน เงิน เข้า ครับ,อยาก ได้ sms แจ้ง เตือน เงิน เข้า ครับ,2
ของกำนัล,แลกพ้อยไปแล้วส่งของกำนัลมาหรือยังครับ,no,แลก พ้อย ไปแล้ว ส่ง ของกำนัล มา หรือยัง ครับ,แลก พ้อย ไปแล้ว ส่ง ของกำนัล มา หรือยัง ครับ,แลก พ้อย ไปแล้ว ส่ง ของกำนัล มา หรือยัง ครับ,2
การรับ OTP,ระบบบอกให้ใส่รหัส otp ดูจากตรงไหนครับ,no,ระบบ บอก ให้ ใส่ รหัส otp ดู จาก ตรงไหน ครับ,ระบบ บอก ให้ ใส่ รหัส otp ดู จาก ตรงไหน ครับ,ระบบ บอก ให้ ใส่ รหัส otp ดู จาก ตรงไหน ครับ,2
สิทธิพิเศษ,เปิดบัญชีแล้วมีโปรโมชั่นอะไรรึป่าว,no,เปิดบัญชี แล้ว มี โปรโมชั่น อะไร หรือ เปล่า,เปิดบัญชี แล้ว มี โปรโมชั่น อะไร หรือ เปล่า,เปิดบัญชี แล้ว มี โปรโมชั่น อะไร หรือ เปล่า,2
วันหมดอายุบัตร,ไปกดใช้กรุงศรีกิ๊บที่หน้าร้านแต่พนักงานบอกว่าหมดอายุ,no,ไป กด ใช้ กรุงศรี กิ๊บ ที่ หน้าร้าน แต่ พนักงาน บอกว่า หมดอายุ,ไป กด ใช้ กรุงศรี กิ๊บ ที่ หน้าร้าน แต่ พนักงาน บอกว่า หมดอายุ,ไป กด ใช้ กรุงศรี กิ๊บ ที่ หน้าร้าน แต่ พนักงาน บอกว่า หมดอายุ,2
รหัสการทำรายการ,เอาสมุดไปอัพมา แล้วมันมีตัวอักษร อยากรู้ว่าแต่ละตัวแปลว่าอะไร,no,เอา สมุด ไป อัพ มา แล้ว มัน มี ตัวอักษร อยากรู้ ว่า แต่ละ ตัว แปลว่า อะไร,เอา สมุด ไป อัพ มา แล้ว มัน มี ตัวอักษร อยากรู้ ว่า แต่ละ ตัว แปลว่า อะไร,เอา สมุด ไป อัพ มา แล้ว มัน มี ตัวอักษร อยากรู้ ว่า แต่ละ ตัว แปลว่า อะไร,2
ดาวน์โหลดแบบฟอร์ม,ดาวน์โหลดแบบฟอร์มได้ที่ไหนบ้าง,no,ดาวน์โหลด แบบ ฟอร์ม ได้ ที่ไหนบ้าง,ดาวน์โหลด แบบฟอร์ม ได้ ที่ไหนบ้าง,ดาวน์โหลด แบบฟอร์ม ได้ ที่ไหนบ้าง,2
สำเนาใบเสร็จ,ใบเสร็จสินเชื่อบุคคลไม่เห็นส่งมา,no,ใบเสร็จ สินเชื่อบุคคล ไม่เห็น ส่ง มา,ใบเสร็จ สินเชื่อบุคคล ไม่เห็น ส่ง มา,ใบเสร็จ สินเชื่อบุคคล ไม่เห็น ส่ง มา,2
ตรวจสอบสถานะการจัดส่ง,ต้องนำใบเสร็จไปชำระค่างวด ตอนนี้จัดส่งให้หรือยัง,no,ต้อง นำ ใบเสร็จ ไป ชำระ ค่างวด ตอนนี้ จัดส่ง ให้ หรือยัง,ต้อง นำ ใบเสร็จ ไป ชำระ ค่างวด ตอนนี้ จัดส่ง ให้ หรือยัง,ต้อง นำ ใบเสร็จ ไป ชำระ ค่างวด ตอนนี้ จัดส่ง ให้ หรือยัง,2
เอกสารยืนยันการยอด,ขอสำเนาหนังสือรับรองสินเชื่อบ้าน,no,ขอ สำเนา หนังสือรับรอง สินเชื่อ บ้าน,ขอ สำเนา หนังสือรับรอง สินเชื่อ บ้าน,ขอ สำเนา หนังสือรับรอง สินเชื่อ บ้าน,2
สำรวจความพึงพอใจ,กดประเมินการบริการผ่านช่องทางใด,yes,กด ประเมิน การบริการ ผ่าน ช่องทาง ใด,กด ประเมิน การบริการ ผ่าน ช่องทาง ใด,กด ประเมิน การบริการ ผ่าน ช่องทาง ใด,2
ขอยกเว้นดอกเบี้ย,กรุงศรีมียกเว้นดอกเบี้ยรึป่าว,no,กรุงศรี มี ยกเว้น ดอกเบี้ย หรือ เปล่า,กรุงศรี มี ยกเว้น ดอกเบี้ย หรือ เปล่า,กรุงศรี มี ยกเว้น ดอกเบี้ย หรือ เปล่า,2
ปัญหาการสมัครสินเชื่อ,ยื่นเอกสารสมัครสินเชื่อบุคคลไปครบ แต่กลับแจ้งว่าไม่ครบ ยังไง,no,ยื่น เอกสาร สมัคร สินเชื่อบุคคล ไป ครบ แต่ กลับ แจ้ง ว่า ไม่ ครบ ยังไง,ยื่น เอกสาร สมัคร สินเชื่อบุคคล ไป ครบ แต่ กลับ แจ้ง ว่า ไม่ ครบ ยังไง,ยื่น เอกสาร สมัคร สินเชื่อบุคคล ไป ครบ แต่ กลับ แจ้ง ว่า ไม่ ครบ ยังไง,2
การใช้บัตรเกินจำนวนครั้ง,อะไรคือใช้บัตรเกินจำนวนครั้ง,yes,อะไร คือ ใช้ บัตร เกิน จำนวน ครั้ง,อะไร คือ ใช้ บัตร เกิน จำนวน ครั้ง,อะไร คือ ใช้ บัตร เกิน จำนวน ครั้ง,2
ปัญหาไม่ได้รับเงินโอนจาก True wallet เข้าบัญชี,ทำไมไม่มีเงินเข้าบัญชี ต้นทาง true wallet,yes,ทำไม ไม่มี เงิน เข้าบัญชี ต้นทาง true wallet,ทำไม ไม่มี เงิน เข้าบัญชี ต้นทาง true wallet,ทำไม ไม่มี เงิน เข้าบัญชี ต้นทาง true wallet,2
ระยะเวลาตรวจสอบการโอนผิดบัญชี,โอนผิดใช้เวลาตรวจสอบนานแค่ไหน,yes,โอน ผิด ใช้ เวลา ตรวจสอบ นาน แค่ไหน,โอน ผิด ใช้ เวลา ตรวจสอบ นาน แค่ไหน,โอน ผิด ใช้ เวลา ตรวจสอบ นาน แค่ไหน,2
สถานะการสมัครงาน,อยากรู้ผลการสัมภาษณ์งาน,yes,อยากรู้ ผล การสัมภาษณ์ งาน,อยากรู้ ผล การสัมภาษณ์ งาน,อยากรู้ ผล การสัมภาษณ์ งาน,2
ไม่ได้ใช้งานแต่ได้รับ OTP,กรุงศรีส่ง otp อะไรมาเนี่ย,no,กรุงศรี ส่ง otp อะไร มา เนี่ย,กรุงศรี ส่ง otp อะไร มา เนี่ย,กรุงศรี ส่ง otp อะไร มา เนี่ย,2
สมัครงาน,จบปริญญาตรี คณะบัญชี สมัครงานตำแหน่งไหนได้บ้าง,yes,จบ ปริญญาตรี คณะบัญชี สมัครงาน ตำแหน่ง ไหน ได้ บ้าง,จบ ปริญญาตรี คณะบัญชี สมัครงาน ตำแหน่ง ไหน ได้ บ้าง,จบ ปริญญาตรี คณะบัญชี สมัครงาน ตำแหน่ง ไหน ได้ บ้าง,3
สิทธิขั้นพื้นฐานผู้บริโภค,ผมต้องทราบสิดทิคุ้มคองผู้บอริโภกที่มีต่อธนาคาน,yes,ผม ต้อง ทราบ สิ ด ทิ คุ้ม คอง ผู้ บอ ริ โภ ก ที่ มี ต่อ ธนา คาน,ผม ต้อง ทราบ สิทธิ คุ้ม คอง ผู้ บอ ริ โภ ก ที่ มี ต่อ ธนาคาร,ผม ต้อง ทราบ สิทธิ คุ้ม คอง ผู้ บอ ริ โภ ก ที่ มี ต่อ ธนาคาร,3
แจ้งปัญหาการ login,ลอกอินไม่ได้เลย ทำยังไงดี,no,ลอก อิน ไม่ได้ เลย ทำ ยัง ไงดี,ลอก อิน ไม่ได้ เลย ทำ ยัง ไงดี,login ไม่ได้ เลย ทำ ยัง ไงดี,3
สอบถามค่าธรรมเนียมการออกบัตรใหม่,บัตรหัก ทำใหม่เสียเงินมั้ย,no,บัตร หัก ทำ ใหม่ เสีย เงิน ม ั ้ ย,บัตร หัก ทำ ใหม่ เสีย เงิน ไหม,บัตร หัก ทำ ใหม่ เสีย เงิน ไหม,3
เปลี่ยนแปลงหมายเลขโทรศัพท์,แจ้งเปลี่ยนเบอรโทรได้ที่ไหน ยังไงบ้าง,yes,แจ้ง เปลี่ยน เบอร โทร ได้ ที่ไหน ยังไง บ้าง,แจ้ง เปลี่ยน เบอร์ โทร ได้ ที่ไหน ยังไง บ้าง,แจ้ง เปลี่ยน เบอร์ โทร ได้ ที่ไหน ยังไง บ้าง,3
เปลี่ยนแปลงหมายเลขโทรศัพท์รับ otp,เพิ่งเปลี่ยนเบอร์มา อยากเปลี่ยนข้อมูลรับ otp,yes,เพิ่ง เปลี่ยน เบอร์มา อยาก เปลี่ยน ข้อมูล รับ otp,เพิ่ง เปลี่ยน เบอร์มา อยาก เปลี่ยน ข้อมูล รับ otp,เพิ่ง เปลี่ยน เบอร์มา อยาก เปลี่ยน ข้อมูล รับ otp,3
สอบถามผลการอนุมัติสินเชื่อ,อยากทราบผลการสมัคสถานะสิเชื่อ ผมไปดูที่สาขาได้มั้ย,no,อยาก ทราบ ผล กา รส มัค สถานะ สิ เชื่อ ผม ไปดู ที่ สาขา ได้ ม ั ้ ย,อยาก ทราบผล การ สมัคร สถานะ สิ เชื่อ ผม ไปดู ที่ สาขา ได้ไหม,อยาก ทราบผล การ สมัคร สถานะ สิ เชื่อ ผม ไปดู ที่ สาขา ได้ไหม,3
สอบถาม cheque clearing,บริการรับฝากเช็คเคลียริ่งมีขั้นตอนอะไรบ้าง,no,บริการ รับฝาก เช็ค เคลียริ่ง มี ขั้นตอน อะไร บ้าง,บริการ รับฝาก เช็ค เคลียริ่ง มี ขั้นตอน อะไรบ้าง,บริการ รับฝาก เช็ค เคลียริ่ง มี ขั้นตอน อะไรบ้าง,3
สอบถาม cheque,เชคเงินสดมีอายุกี่วัน กี่เดือนครับ,no,เชค เงินสด มีอายุ กี่ วัน กี่ เดือน ครับ,เช็ค เงินสด มีอายุ กี่ วัน กี่ เดือน ครับ,เช็ค เงินสด มีอายุ กี่ วัน กี่ เดือน ครับ,3
ปัญหาการกดเงินสดตู้ต่างธนาคาร,เปลี่ยนบัตร atm แบบชิปการ์ดมา แต่กดตู้ธนาคารอื่นได้ไม่ได้เลย,yes,เปลี่ยน บัตร atm แบบ ชิป การ์ด มา แต่ กด ตู้ ธนาคาร อื่น ได้ ไม่ได้ เลย,เปลี่ยน บัตร atm แบบ ชิป การ์ด มา แต่ กด ตู้ ธนาคาร อื่น ได้ ไม่ได้ เลย,เปลี่ยน บัตร atm แบบ ชิป การ์ด มา แต่ กด ตู้ ธนาคาร อื่น ได้ ไม่ได้ เลย,3
เจ้าของบัญชีเสียชีวิต,ถ้าหลักฐานไม่ครบจะถอนเงินเพื่อปิดบัญชีของผู้เสียชีวิตได้มั้ย,yes,ถ้า หลักฐาน ไม่ ครบ จะ ถอนเงิน เพื่อ ปิดบัญชี ของ ผู้ เสียชีวิต ได้ ม ั ้ ย,ถ้า หลักฐาน ไม่ ครบ จะ ถอนเงิน เพื่อ ปิดบัญชี ของ ผู้ เสียชีวิต ได้ไหม,ถ้า หลักฐาน ไม่ ครบ จะ ถอนเงิน เพื่อ ปิดบัญชี ของ ผู้ เสียชีวิต ได้ไหม,3
ติดต่อ admin,มีadminมั้ย คุยกับผมหน่อย,no,มี admin ม ั ้ ย คุย กับ ผม หน่อย,มี admin ไหม คุย กับ ผม หน่อย,มี admin ไหม คุย กับ ผม หน่อย,3
สอบถามหมายเลขโทรศัพท์ call center,call center บัตรเครดิตกรุงศรีเพื่อติดต่อพนักงานกดเบอร์อะไร,yes,call center บัตรเครดิต กรุงศรี เพื่อ ติดต่อ พนักงาน กด เบอร์ อะไร,call center บัตรเครดิต กรุงศรี เพื่อ ติดต่อ พนักงาน กด เบอร์ อะไร,call center บัตรเครดิต กรุงศรี เพื่อ ติดต่อ พนักงาน กด เบอร์ อะไร,3
สอบถามข้อมูลสาขา,อยากทราบเบอร์ เวลาเปิดปิดสาขา central world,yes,อยาก ทราบ เบอร์ เวลาเปิดปิด สาขา central world,อยาก ทราบ เบอร์ เวลาเปิดปิด สาขา central world,อยาก ทราบ เบอร์ เวลาเปิดปิด สาขา central world,3
สอบถามการ claim ประกัน,ติดต่อเคลมประกันได้ตอนไหนบ้าง 24 ชมปะ,no,ติดต่อ เคลม ประกัน ได้ ตอน ไหน บ้าง ## ชม ปะ,ติดต่อ เคลม ประกัน ได้ ตอน ไหน บ้าง ## ชม ปะ,ติดต่อ เคลม ประกัน ได้ ตอน ไหน บ้าง ## ชม ปะ,3
สอบถามค่าธรรมเนียมบัตร,มีบัตรเดบิตที่ไม่เสียค่าธรรมเนียมมั้ยครับ,no,มี บัตรเดบิต ที่ ไม่ เสียค่าธรรมเนียม ม ั ้ ย ครับ,มี บัตรเดบิต ที่ ไม่ เสียค่าธรรมเนียม ไหม ครับ,มี บัตรเดบิต ที่ ไม่ เสียค่าธรรมเนียม ไหม ครับ,3
ข้อมูลผลิตภัณฑ์ประเภทบัญชี,มีเงินอยู่ 3 ล้าน ฝากบัญชีไหนดีสุด,yes,มี เงินอยู่ 3 ล้าน ฝาก บัญชี ไหน ดี สุด,มี เงินอยู่ 3 ล้าน ฝาก บัญชี ไหน ดี สุด,มี เงินอยู่ 3 ล้าน ฝาก บัญชี ไหน ดี สุด,3
สอบถามการโอนเงินไปต่างประเทศ,โอนเงินจากบัญชีกรุงศรีไปตปทได้หรือไม่,no,โอนเงิน จาก บัญชี กรุงศรี ไป ต ปท ได้ หรือไม่,โอนเงิน จาก บัญชี กรุงศรี ไป ต่างประเทศ ได้ หรือไม่,โอนเงิน จาก บัญชี กรุงศรี ไป ต่างประเทศ ได้ หรือไม่,3
สอบถามยอดเงินในบัญชี,ดูยอดเงินในบัญชีผ่านทางไหนได้,yes,ดู ยอดเงิน ใน บัญชี ผ่านทาง ไหน ได้,ดู ยอดเงิน ใน บัญชี ผ่านทาง ไหน ได้,ดู ยอดเงิน ใน บัญชี ผ่านทาง ไหน ได้,3
สอบถามค่าธรรมเนียมเปิดสมุดบัญชีใหม่,ค่าธรรมเนียมเปิดบัญชีกี่บาท,no,ค่าธรรมเนียม เปิดบัญชี กี่ บาท,ค่าธรรมเนียม เปิดบัญชี กี่ บาท,ค่าธรรมเนียม เปิดบัญชี กี่ บาท,3
สอบถามยอดชำระ,สอบถามค่างวดที่ต้องชำระหน่อยครับ,no,สอบถาม ค่างวด ที่ ต้อง ชำระ หน่อย ครับ,สอบถาม ค่างวด ที่ ต้อง ชำระ หน่อย ครับ,สอบถาม ค่างวด ที่ ต้อง ชำระ หน่อย ครับ,3
สอบถามวงเงินคงเหลือ,อยู่ ตปท ดูวงเงินที่ผมเหลือยังไงได้บ้าง,no,อยู่ ต ปท ดู วงเงิน ที่ ผม เหลือ ยังไง ได้ บ้าง,อยู่ ต่างประเทศ ดู วงเงิน ที่ ผม เหลือ ยังไง ได้ บ้าง,อยู่ ต่างประเทศ ดู วงเงิน ที่ ผม เหลือ ยังไง ได้ บ้าง,3
สอบถาม swift code,ขอรหัส swift code เพื่อใช่โอนเงินด้วยครับ,no,ขอ รหัส swift code เพื่อ ใช่ โอนเงิน ด้วย ครับ,ขอ รหัส swift code เพื่อ ใช่ โอนเงิน ด้วย ครับ,ขอ รหัส swift code เพื่อ ใช่ โอนเงิน ด้วย ครับ,3
สอบถามการต่อประกัน,ได้รับใบแจ้งเตือนใบต่ออายุกรมธรรม์,yes,ได้รับ ใบ แจ้ง เตือน ใบ ต่ออายุ กรมธรรม์,ได้รับ ใบ แจ้ง เตือน ใบ ต่ออายุ กรมธรรม์,ได้รับ ใบ แจ้ง เตือน ใบ ต่ออายุ กรมธรรม์,3
สอบถามค่าธรรมเนียมการโอนเงิน,ขอข้อมูลค่าธรรมเนียมโอนเงินต่างประเทศทั้งหมด,no,ขอ ข้อมูล ค่าธรรมเนียม โอนเงิน ต่างประเทศ ทั้งหมด,ขอ ข้อมูล ค่าธรรมเนียม โอนเงิน ต่างประเทศ ทั้งหมด,ขอ ข้อมูล ค่าธรรมเนียม โอนเงิน ต่างประเทศ ทั้งหมด,3
ปัญหายังไม่ได้รับของกำนัลตามเงื่อนไข,สอบถามวิธีการติดตามของแถมที่ผมยังไม่ได้,no,สอบถาม วิธีการ ติดตาม ของแถม ที่ ผม ยัง ไม่ได้,สอบถาม วิธีการ ติดตาม ของแถม ที่ ผม ยัง ไม่ได้,สอบถาม วิธีการ ติดตาม ของแถม ที่ ผม ยัง ไม่ได้,3
ลืมรหัส,ผมลืมพาสเวิด ทำยังไง,yes,ผม ลืม พาส เวิด ทำ ยังไง,ผม ลืม password ทำ ยังไง,ผม ลืม password ทำ ยังไง,3
สอบถามเวลาปิดรับ cheque,ธนาคารในห้างปิดรับเชคที่โมง,yes,ธนาคาร ใน ห้าง ปิด รับ เชค ที่ โมง,ธนาคาร ใน ห้าง ปิด รับ เช็ค ที่ โมง,ธนาคาร ใน ห้าง ปิด รับ เช็ค ที่ โมง,3
ข้อมูลผลิตภัณฑ์ประเภทประกัน,ประกันชีวิต มีอะไรบ้าง,no,ประกันชีวิต มี อะไร บ้าง,ประกันชีวิต มีอะไรบ้าง,ประกันชีวิต มีอะไรบ้าง,3
