expected semantic name,input,correct/incorrect,not_correct_segment,correct_segment_v2,correct_segment_v3,no_idx_in_semantic
สมัครงาน,มีตำแหน่งอะไรว่างบ้าง,yes,มี ตำแหน่ง อะไร ว่าง บ้าง,มี ตำแหน่ง อะไร ว่าง บ้าง,มี ตำแหน่ง อะไร ว่าง บ้าง,1
ปัญหาไม่สามารถใช้วงเงินที่มีอยู่ได้,บัญชีผมมีเงินอยู่ แต่ทำไมใช้เงินในบัญชีไม่ได้,no,บัญชี ผม มี เงินอยู่ แต่ ทำไม ใช้ เงิน ใน บัญชี ไม่ได้,บัญชี ผม มี เงินอยู่ แต่ ทำไม ใช้ เงิน ใน บัญชี ไม่ได้,บัญชี ผม มี เงินอยู่ แต่ ทำไม ใช้ เงิน ใน บัญชี ไม่ได้,1
ปัญหาไม่สามารถใช้วงเงินที่มีอยู่ในบัญชีได้,มียอดคงเหลือในบัญชี แต่ไม่สามารถถอนได้มันคืออะไร,no,มี ยอด คงเหลือ ใน บัญชี แต่ ไม่สามารถ ถอน ได้ มันคืออะไร,มี ยอด คงเหลือ ใน บัญชี แต่ ไม่สามารถ ถอน ได้ มันคืออะไร,มี ยอด คงเหลือ ใน บัญชี แต่ ไม่สามารถ ถอน ได้ มันคืออะไร,1
ปัญหาการกดเงินสด,มียอดเงินใน บช แต่ทำไมกดเงิน atm ไม่ได้,no,มี ยอดเงิน ใน บ ช แต่ ทำไม กด เงิน atm ไม่ได้,มี ยอดเงิน ใน บัญชี แต่ ทำไม กดเงิน atm ไม่ได้,มี ยอดเงิน ใน บัญชี แต่ ทำไม กดเงิน atm ไม่ได้,1
สิทธิขั้นพื้นฐานผู้บริโภค,สิทธิของลูกค้าอย่างผมมีอะไรบ้าง,yes,สิทธิ ของ ลูกค้า อย่าง ผม มี อะไร บ้าง,สิทธิ ของ ลูกค้า อย่าง ผม มีอะไรบ้าง,สิทธิ ของ ลูกค้า อย่าง ผม มีอะไรบ้าง,1
ร้องเรียนบริการ,ผมเสียหายจากการแนะนำการขายของพนักงาน ร้องเรียนได้ยังไงบ้าง,yes,ผม เสียหาย จาก การ แนะนำ การ ขายของ พนักงาน ร้องเรียน ได้ ยังไง บ้าง,ผม เสียหาย จาก การ แนะนำ การ ขายของ พนักงาน ร้องเรียน ได้ ยังไง บ้าง,ผม เสียหาย จาก การ แนะนำ การ ขายของ พนักงาน ร้องเรียน ได้ ยังไง บ้าง,1
สอบถามการผ่อนชำระ,ช่วยคิดเงินผ่อนสินเชื่อให้หน่อย,no,ช่วย คิด เงินผ่อน สินเชื่อ ให้ หน่อย,ช่วย คิด เงินผ่อน สินเชื่อ ให้หน่อย,ช่วย คิด เงินผ่อน สินเชื่อ ให้หน่อย,1
สอบถามยอดผ่อนชำระต่อเดือน,ผ่อนสินเชื่อคอนโด 3000000 48 เดือน เดือนละเท่าไหร่ ดอกเบี้ยกี่บาท,no,ผ่อน สินเชื่อ คอนโด ####### ## เดือน เดือนละ เท่าไหร่ ดอกเบี้ย กี่ บาท,ผ่อน สินเชื่อ คอนโด ####### ## เดือน เดือนละ เท่าไหร่ ดอกเบี้ย กี่ บาท,ผ่อน สินเชื่อ คอนโด ####### ## เดือน เดือนละ เท่าไหร่ ดอกเบี้ย กี่ บาท,1
คำนวณสินเชื่อ,how to calculate interest on loan ?,yes,how to calculate interest on loan ?,how to calculate interest on loan ?,how to calculate interest on loan ?,1
แจ้งปัญหาการ login,login เข้าเวปไม่ได้,no,login เข้า เวป ไม่ได้,login เข้า เว็บ ไม่ได้,login เข้า เว็บ ไม่ได้,1
สอบถามค่าธรรมเนียมการออกบัตรใหม่,ค่าธรรมเนียมของบัตรหมดอายุที่จะทำใหม่เท่าไหร่,no,ค่าธรรมเนียม ของ บัตร หมดอายุ ที่ จะทำ ใหม่ เท่าไหร่,ค่าธรรมเนียม ของ บัตร หมดอายุ ที่ จะทำ ใหม่ เท่าไหร่,ค่าธรรมเนียม ของ บัตร หมดอายุ ที่ จะทำ ใหม่ เท่าไหร่,1
บัตรหมดอายุ,บัตรหมดอายุ ทำบัตรใหม่ต้องใช้ข้อมูลอะไรบ้างครับ,no,บัตร หมดอายุ ทำ บัตร ใหม่ ต้อง ใช้ ข้อมูล อะไร บ้าง ครับ,บัตร หมดอายุ ทำบัตร ใหม่ ต้อง ใช้ ข้อมูล อะไรบ้าง ครับ,บัตร หมดอายุ ทำบัตร ใหม่ ต้อง ใช้ ข้อมูล อะไรบ้าง ครับ,1
สอบถามการทำบัตร,บัตรชำรุด ต้องใช้อะไรบ้างเพื่อทำบัตรใหม่,no,บัตร ชำรุด ต้อง ใช้ อะไร บ้าง เพื่อ ทำ บัตร ใหม่,บัตร ชำรุด ต้องใช้อะไรบ้าง เพื่อ ทำบัตร ใหม่,บัตร ชำรุด ต้องใช้อะไรบ้าง เพื่อ ทำบัตร ใหม่,1
เปลี่ยนแปลงที่อยู่,ต้องการเปลี่ยนแปลงข้อมูลที่อยู่ ต้องทำยังไงบ้าง,yes,ต้องการ เปลี่ยนแปลง ข้อมูล ที่อยู่ ต้อง ทำ ยังไง บ้าง,ต้องการ เปลี่ยนแปลง ข้อมูล ที่อยู่ ต้อง ทำ ยังไง บ้าง,ต้องการ เปลี่ยนแปลง ข้อมูล ที่อยู่ ต้อง ทำ ยังไง บ้าง,1
เปลี่ยนแปลงที่อยู่จัดส่งเอกสาร,ใช้เอกสารอะไรบ้างในการเปลี่ยนแปลงที่อยู่รับเอกสาร,yes,ใช้ เอกสาร อะไร บ้าง ใน การ เปลี่ยนแปลง ที่อยู่ รับ เอกสาร,ใช้ เอกสาร อะไรบ้าง ใน การ เปลี่ยนแปลง ที่อยู่ รับ เอกสาร,ใช้ เอกสาร อะไรบ้าง ใน การ เปลี่ยนแปลง ที่อยู่ รับ เอกสาร,1
เปลี่ยนแปลงข้อมูล,แต่งงานแล้ว อยากแก้ไขข้อมูลประวัติครับ,yes,แต่งงาน แล้ว อยากแก้ไข ข้อมูล ประวัติ ครับ,แต่งงาน แล้ว อยากแก้ไข ข้อมูล ประวัติ ครับ,แต่งงาน แล้ว อยากแก้ไข ข้อมูล ประวัติ ครับ,1
เปลี่ยนแปลงชื่อสกุล,เปลี่ยนชื่อมา อยากแก้ไขข้อมูลส่วนตัวกับทางธนาคาร ต้องแจ้งเปลี่ยนยังไงบ้าง,yes,เปลี่ยน ชื่อ มา อยากแก้ไข ข้อมูลส่วนตัว กับ ทาง ธนาคาร ต้อง แจ้ง เปลี่ยน ยังไง บ้าง,เปลี่ยน ชื่อ มา อยากแก้ไข ข้อมูลส่วนตัว กับ ทาง ธนาคาร ต้อง แจ้ง เปลี่ยน ยังไง บ้าง,เปลี่ยน ชื่อ มา อยากแก้ไข ข้อมูลส่วนตัว กับ ทาง ธนาคาร ต้อง แจ้ง เปลี่ยน ยังไง บ้าง,1
เปลี่ยนแปลงหมายเลขโทรศัพท์,เปลี่ยนเบอร์โทรศัพท์ที่ผูกกับบัตร atm ยังไง,yes,เปลี่ยน เบอร์โทรศัพท์ ที่ ผูก กับ บัตร atm ยังไง,เปลี่ยน เบอร์โทรศัพท์ ที่ ผูก กับ บัตร atm ยังไง,เปลี่ยน เบอร์โทรศัพท์ ที่ ผูก กับ บัตร atm ยังไง,1
เปลี่ยนแปลงหมายเลขโทรศัพท์รับ otp,เปลี่ยนเบอร์รับรหัส otp มีวิธีมั้ยครับ,yes,เปลี่ยน เบอร์ รับ รหัส otp มี วิธี ม ั ้ ย ครับ,เปลี่ยน เบอร์ รับ รหัส otp มี วิธี ไหม ครับ,เปลี่ยน เบอร์ รับ รหัส otp มี วิธี ไหม ครับ,1
ไม่ได้รับ otp,รอรับ โอทีพี มานานแล้วแต่ยังไม่ได้ สงสัยใช้เบอร์เก่า ต้องแก้ไขยังไง,no,รอ รับ โอทีพี มานาน แล้วแต่ ยัง ไม่ได้ สงสัย ใช้ เบอร์ เก่า ต้อง แก้ไข ยังไง,รอ รับ otp มานาน แล้วแต่ ยัง ไม่ได้ สงสัย ใช้ เบอร์ เก่า ต้อง แก้ไข ยังไง,รอ รับ otp มานาน แล้วแต่ ยัง ไม่ได้ สงสัย ใช้ เบอร์ เก่า ต้อง แก้ไข ยังไง,1
สอบถาม cheque clearing,เอาเชคเงินสดเข้าบัญชีไปแล้ว ไม่ทราบว่าเงินจะเข้าวันไหน,yes,เอา เชค เงินสด เข้าบัญชี ไปแล้ว ไม่ ทราบว่า เงิน จะ เข้า วัน ไหน,เอา เช็ค เงินสด เข้าบัญชี ไปแล้ว ไม่ ทราบว่า เงิน จะ เข้า วัน ไหน,เอา เช็ค เงินสด เข้าบัญชี ไปแล้ว ไม่ ทราบว่า เงิน จะ เข้า วัน ไหน,1
สั่งซื้อสมุด cheque,ผมซื้อแคชเชียเชค สั่งจ่ายค่าธรรมเนียมไปแล้ว ผมจะรู้ได้ยังไงว่าชำระแล้วอะ,no,ผม ซื้อ แคช เชีย เชค สั่ง จ่าย ค่าธรรมเนียม ไปแล้ว ผม จะ รู้ ได้ ยังไง ว่า ชำระ แล้ว อะ,ผม ซื้อ แคช เชีย เช็ค สั่ง จ่าย ค่าธรรมเนียม ไปแล้ว ผม จะ รู้ ได้ ยังไง ว่า ชำระ แล้ว อะ,ผม ซื้อ แคช เชีย เช็ค สั่ง จ่าย ค่าธรรมเนียม ไปแล้ว ผม จะ รู้ ได้ ยังไง ว่า ชำระ แล้ว อะ,1
สอบถาม cheque,สอบถามการตรวจสอบสถานะเช็ค,no,สอบถาม การ ตรวจสอบ สถานะ เช็ค,สอบถาม การ ตรวจสอบ สถานะ เช็ค,สอบถาม การ ตรวจสอบ สถานะ เช็ค,1
ตรวจสอบสถานะเช็ค,how can i check cheque status ?,yes,how can i check cheque status ?,how can i check cheque status ?,how can i check cheque status ?,1
ตรวจสอบสถานะการสมัคร,ขอวิธีการตรวจสอบสถานะสมัครสินเชื่อ,no,ขอ วิธีการ ตรวจสอบ สถานะ สมัคร สินเชื่อ,ขอ วิธีการ ตรวจสอบ สถานะ สมัคร สินเชื่อ,ขอ วิธีการ ตรวจสอบ สถานะ สมัคร สินเชื่อ,1
สอบถามผลการอนุมัติสินเชื่อ,สมัครสินเชื่อผ่านมั้ย,no,สมัคร สินเชื่อ ผ่าน ม ั ้ ย,สมัคร สินเชื่อ ผ่าน ไหม,สมัคร สินเชื่อ ผ่าน ไหม,1
ปัญหาการกดเงินสดตู้ต่างธนาคาร,เสียบบัตรที่ตู้ธนาคารกสิกรไม่ได้ ทำไง,yes,เสียบ บัตร ที่ ตู้ ธนาคารกสิกร ไม่ได้ ทำไง,เสียบ บัตร ที่ ตู้ ธนาคารกสิกร ไม่ได้ ทำไง,เสียบ บัตร ที่ ตู้ ธนาคารกสิกร ไม่ได้ ทำไง,1
แจ้งปัญหาการใช้งานตู้ atm,กดเงินไม่ได้ ตู้ atm ขึ้น ขออภัย เครื่องยังไม่รองรับการทำรายการจากบัตรชิปการ์ด กรุณารับบัตรคืน,no,กด เงิน ไม่ได้ ตู้ atm ขึ้น ขออภัย เครื่อง ยัง ไม่ รองรับ การ ทำ รายการ จาก บัตร ชิป การ์ด กรุณา รับ บัตร คืน,กดเงิน ไม่ได้ ตู้ atm ขึ้น ขออภัย เครื่อง ยัง ไม่ รองรับ การ ทำ รายการ จาก บัตร ชิป การ์ด กรุณา รับ บัตร คืน,กดเงิน ไม่ได้ ตู้ atm ขึ้น ขออภัย เครื่อง ยัง ไม่ รองรับ การ ทำ รายการ จาก บัตร ชิป การ์ด กรุณา รับ บัตร คืน,1
สอบถามการปิดบัญชี,ปิดบัญชีต่างสาขาได้มั้ย,no,ปิดบัญชี ต่าง สาขา ได้ ม ั ้ ย,ปิดบัญชี ต่าง สาขา ได้ไหม,ปิดบัญชี ต่าง สาขา ได้ไหม,1
ต้องการปิดบัญชี,ปิดบัญชีออมทรัพย์ยังไง,no,ปิดบัญชี ออมทรัพย์ ยังไง,ปิดบัญชี ออมทรัพย์ ยังไง,ปิดบัญชี ออมทรัพย์ ยังไง,1
เจ้าของบัญชีเสียชีวิต,ต้องมีหลักฐานอะไรบ้างในการปิดบัญชีผู้เสียชีวิต,yes,ต้อง มี หลักฐาน อะไร บ้าง ใน การ ปิดบัญชี ผู้ เสียชีวิต,ต้อง มี หลักฐาน อะไรบ้าง ใน การ ปิดบัญชี ผู้ เสียชีวิต,ต้อง มี หลักฐาน อะไรบ้าง ใน การ ปิดบัญชี ผู้ เสียชีวิต,1
ติดต่อ admin,อยากคุยกับเจ้าหน้าที่,no,อยาก คุย กับ เจ้าหน้าที่,อยาก คุย กับ เจ้าหน้าที่,อยาก คุย กับ เจ้าหน้าที่,1
ต้องการให้ธนาคารติดต่อกลับ,รอการติดต่อจากเจ้าหน้าที่อยู่นะครับ ไม่ทราบว่าจะติดต่อมาตอนไหน,yes,รอ การ ติดต่อ จาก เจ้าหน้าที่ อยู่ นะครับ ไม่ทราบ ว่า จะ ติดต่อ มา ตอน ไหน,รอ การ ติดต่อ จาก เจ้าหน้าที่ อยู่ นะครับ ไม่ทราบ ว่า จะ ติดต่อ มา ตอน ไหน,รอ การ ติดต่อ จาก เจ้าหน้าที่ อยู่ นะครับ ไม่ทราบ ว่า จะ ติดต่อ มา ตอน ไหน,1
สอบถามข้อมูลสำนักงานใหญ่,ขอแผนที่สำนักงานใหญ่,yes,ขอ แผนที่ สำนักงานใหญ่,ขอ แผนที่ สำนักงานใหญ่,ขอ แผนที่ สำนักงานใหญ่,1
สอบถามหมายเลขโทรศัพท์ call center,เบอติดต่อกับ สนง ใหญ่ เบอไร,no,เบอ ติดต่อ กับ ส นง ใหญ่ เบ อไร,เบอร์ ติดต่อ กับ สำนักงาน ใหญ่ เบอร์_อะไร,เบอร์ ติดต่อ กับ สำนักงาน ใหญ่ เบอร์_อะไร,1
สอบถามข้อมูลสาขา,เวลาเปิดปิดกี่โมงที่สาขายานนาวา,yes,เวลาเปิดปิด กี่โมง ที่ สาขา ยานนาวา,เวลาเปิดปิด กี่โมง ที่ สาขา ยานนาวา,เวลาเปิดปิด กี่โมง ที่ สาขา ยานนาวา,1
สอบถามการ claim ประกัน,ต้องการเคลมประกันทำยังไงบ้าง,no,ต้องการ เคลม ประกัน ทำ ยังไง บ้าง,ต้องการ เคลม ประกัน ทำ ยังไง บ้าง,ต้องการ เคลม ประกัน ทำ ยังไง บ้าง,1
ขอเพิ่มวงเงินฉุกเฉิน,ค่าผ่าตัด 100000 เบิกได้เท่าไหร่,no,ค่า ผ่าตัด 1##### เบิก ได้ เท่าไหร่,ค่า ผ่าตัด 1##### เบิก ได้ เท่าไหร่,ค่า ผ่าตัด 1##### เบิก ได้ เท่าไหร่,1
สอบถามการสมัครบัตร,เอกสารการสมัครบัตรเดบิต,no,เอกสาร การ สมัคร บัตรเดบิต,เอกสาร การ สมัคร บัตรเดบิต,เอกสาร การ สมัคร บัตรเดบิต,1
คุณสมบัติผู้สมัคร,อายุ 15 สมัครทำเดบิตได้มั้ย,no,อายุ ## สมัคร ทำ เดบิต ได้ ม ั ้ ย,อายุ ## สมัคร ทำ เดบิต ได้ไหม,อายุ ## สมัคร ทำ เดบิต ได้ไหม,1
สอบถามการเปิดบัญชี,มีเงิน600 เปิดบันชีบัดรเดบิด ได้มั้ย,no,มีเงิน 6## เปิด บัน ชี บัด ร เด บิด ได้ ม ั ้ ย,มีเงิน 6## เปิด บัญชี บัตร เดบิต ได้ไหม,มีเงิน 6## เปิด บัญชี บัตร เดบิต ได้ไหม,1
ข้อมูลผลิตภัณฑ์ประเภทบัตร,ป่วยบ่อย สมัครบัตรไหนดี,yes,ป่วย บ่อย สมัคร บัตร ไหน ดี,ป่วย บ่อย สมัคร บัตร ไหน ดี,ป่วย บ่อย สมัคร บัตร ไหน ดี,1
สอบถามสิทธิประโยชน์บัตร,ขอข้อมูลตัวประโยชน์ของบัตรเดบิตว่ามีอะไรบ้าง,yes,ขอ ข้อมูล ตัว ประโยชน์ ของ บัตรเดบิต ว่า มี อะไร บ้าง,ขอ ข้อมูล ตัว ประโยชน์ ของ บัตรเดบิต ว่า มีอะไรบ้าง,ขอ ข้อมูล ตัว ประโยชน์ ของ บัตรเดบิต ว่า มีอะไรบ้าง,1
สิทธิประโยชน์บัตรเดบิต,whu should i use debit card,yes,whu should i use debit card,whu should i use debit card,whu should i use debit card,1
สอบถามค่าธรรมเนียมบัตร,ค่าธรรมเนียมเดบิตกรุงศรีรายปี,no,ค่าธรรมเนียม เดบิต กรุงศรี รายปี,ค่าธรรมเนียม เดบิต กรุงศรี รายปี,ค่าธรรมเนียม เดบิต กรุงศรี รายปี,1
สมัครบัตรใหม่,อยากสมัตรเดบิตสักใบ ขอ info. หน่อย,no,อยาก สม ั ตร เดบิต สัก ใบ ขอ info . หน่อย,อยากสมัคร เดบิต สัก ใบ ขอ info . หน่อย,อยากสมัคร เดบิต สัก ใบ ขอ info . หน่อย,1
ข้อมูลผลิตภัณฑ์ประเภทบัญชี,สอบถามประโยชน์ของเงินฝาก บัญชีไหนดีสุด,yes,สอบถาม ประโยชน์ ของ เงินฝาก บัญชี ไหน ดี สุด,สอบถาม ประโยชน์ ของ เงินฝาก บัญชี ไหน ดี สุด,สอบถาม ประโยชน์ ของ เงินฝาก บัญชี ไหน ดี สุด,1
สอบถามค่าธรรมเนียมรายปี,ค่าธรรมเนียมบัญชีเงินฝากแต่ละบัญชีเท่าไหร่,no,ค่าธรรมเนียม บัญชีเงินฝาก แต่ละ บัญชี เท่าไหร่,ค่าธรรมเนียม บัญชีเงินฝาก แต่ละ บัญชี เท่าไหร่,ค่าธรรมเนียม บัญชีเงินฝาก แต่ละ บัญชี เท่าไหร่,1
สอบถามค่าธรรมเนียม,เงินฝากบัญชีไหน ไม่มีค่าธรรมเนียม,yes,เงินฝาก บัญชี ไหน ไม่มี ค่าธรรมเนียม,เงินฝาก บัญชี ไหน ไม่มี ค่าธรรมเนียม,เงินฝาก บัญชี ไหน ไม่มี ค่าธรรมเนียม,1
