expected semantic name,input,correct/incorrect,not_correct_segment,correct_segment_v2,correct_segment_v3,no_idx_in_semantic
เงินโอนระหว่างประเทศ,โอนเงินต่างประเทศกี่วันได้ค่ะ,yes,โอนเงิน ต่างประเทศ กี่ วัน ได้ ค่ะ,โอนเงิน ต่างประเทศ กี่ วัน ได้ ค่ะ,โอนเงิน ต่างประเทศ กี่ วัน ได้ ค่ะ,11
การแจ้งและการปลดอายัด,พี่จะอายัดบัญชีได้ไหมค่ะ,no,พี่ จะ อายัด บัญชี ได้ไหม ค่ะ,พี่ จะ อายัด บัญชี ได้ ไหมค่ะ,พี่ จะ อายัด บัญชี ได้ ไหมค่ะ,11
ติดต่อ Call Center,ขอเบอร์โทรติดต่อฝ่าย krungsri prime,no,ขอ เบอร์โทร ติดต่อ ฝ่าย krungsri prime,ขอ เบอร์โทร ติดต่อ ฝ่าย krungsri prime,ขอ เบอร์โทร ติดต่อ ฝ่าย krungsri prime,11
ผลิตภัณฑ์บัตรกรุงศรีเดบิต,บัตรเดบิตรูดซื้อสินค้าได้ไหม,no,บัตรเดบิต รูด ซื้อ สินค้า ได้ไหม,บัตรเดบิต รูด ซื้อ สินค้า ได้ไหม,บัตรเดบิต รูด ซื้อ สินค้า ได้ไหม,11
อัตราดอกเบี้ย,สอบถามอัตราดอกเบี้ยรีไฟแนนซ์บ้านกรุงศรี,yes,สอบถาม อัตราดอกเบี้ย รีไฟแนนซ์ บ้าน กรุงศรี,สอบถาม อัตราดอกเบี้ย refinance บ้าน กรุงศรี,สอบถาม อัตราดอกเบี้ย refinance บ้าน กรุงศรี,11
สิทธิขั้นพื้นฐานผู้บริโภค,ทำไมบอกไม่เหมือนกับที่โฆษณาหละ,no,ทำไม บอก ไม่ เหมือนกับ ที่ โฆษณา หละ,ทำไม บอก ไม่ เหมือนกับ ที่ โฆษณา หละ,ทำไม บอก ไม่ เหมือนกับ ที่ โฆษณา หละ,11
การออกบัตรทดแทน,atm expire ตอนนี้อยู่ตปท.ช่วยด้วย,no,atm expire ตอนนี้ อยู่ ตปท. ช่วยด้วย,atm expire ตอนนี้ อยู่ ต่างประเทศ ช่วยด้วย,atm expire ตอนนี้ อยู่ ต่างประเทศ ช่วยด้วย,11
เงื่อนไขเช็คเคลียริ่ง,ฝากเคลียริ่งวันนี้เช้าได้เงินกี่โมง,yes,ฝาก เคลียริ่ง วันนี้ เช้า ได้ เงิน กี่โมง,ฝาก เคลียริ่ง วันนี้ เช้า ได้ เงิน กี่โมง,ฝาก เคลียริ่ง วันนี้ เช้า ได้ เงิน กี่โมง,11
ติดต่อแอดมิน,โทรกลับด้วยคับ,yes,โทร กลับ ด้วย คับ,โทร กลับ ด้วย ครับ,โทร กลับ ด้วย ครับ,11
ติดต่อสาขาธนาคารกรุงศรี,นอกจากสาขาที่อุดมสุขมีสาขาอื่นอีกป่าว,yes,นอกจาก สาขา ที่ อุดม สุขมี สาขา อื่น อีก ป่าว,นอกจาก สาขา ที่ อุดม สุขมี สาขา อื่น อีก ป่าว,นอกจาก สาขา ที่ อุดม สุขมี สาขา อื่น อีก ป่าว,11
เกี่ยวกับบัตรเครดิต,สนใจทำเดบิตกรุงศรี,no,สนใจ ทำ เดบิต กรุงศรี,สนใจ ทำ เดบิต กรุงศรี,สนใจ ทำ เดบิต กรุงศรี,11
รายการเดินบัญชี,ยอดเงินแจ้ง400 หักค่าอะไรครับ,no,ยอดเงิน แจ้ง 4## หัก ค่า อะไร ครับ,ยอดเงิน แจ้ง 4## หัก ค่า อะไร ครับ,ยอดเงิน แจ้ง 4## หัก ค่า อะไร ครับ,11
ลืมรหัสประจำตัว,จะเข้าระบบ แต่จำ user ไม่ได้ครับ,no,จะ เข้า ระบบ แต่ จำ user ไม่ได้ ครับ,จะ เข้า ระบบ แต่ จำ user ไม่ได้ครับ,จะ เข้า ระบบ แต่ จำ user ไม่ได้ครับ,11
คุณสมบัติผู้สมัครสินเชื่อ,ค้าขายสมัครสินเชื่อได้ไหมครับ,yes,ค้าขาย สมัคร สินเชื่อ ได้ไหม ครับ,ค้าขาย สมัคร สินเชื่อ ได้ ไหมครับ,ค้าขาย สมัคร สินเชื่อ ได้ ไหมครับ,11
วงเงิน,โอนpromtpayได้ครั้งละเท่าไหร่,no,โอน promtpay ได้ ครั้ง ละ เท่าไหร่,โอน promptpay ได้ ครั้ง ละ เท่าไหร่,โอน promptpay ได้ ครั้ง ละ เท่าไหร่,11
ผลิตภัณฑ์กองทุน,กองทุนนี้ขายคืนได้เมื่อไหร่,no,กองทุน นี้ ขาย คืน ได้ เมื่อไหร่,กองทุน นี้ ขาย คืน ได้ เมื่อไหร่,กองทุน นี้ ขาย คืน ได้ เมื่อไหร่,11
Verify by VISA,verify by visa คืออะไร,no,verify by visa คือ อะไร,verify by visa คือ อะไร,verify by visa คือ อะไร,11
การออกสมุดคู่ฝากทดแทน,ใช้หลักฐานอะไรบ้าง จะออกบุ๊คแบงค์ใหม่,yes,ใช้ หลักฐาน อะไร บ้าง จะ ออก บุ๊คแบงค์ ใหม่,ใช้ หลักฐาน อะไรบ้าง จะ ออก บุ๊คแบงค์ ใหม่,ใช้ หลักฐาน อะไรบ้าง จะ ออก บุ๊คแบงค์ ใหม่,11
ไถ่ถอน,ปกติไถ่ถอนโฉนดใช้เวลากี่วัน,yes,ปกติ ไถ่ถอน โฉนด ใช้ เวลา กี่ วัน,ปกติ ไถ่ถอน โฉนด ใช้ เวลา กี่ วัน,ปกติ ไถ่ถอน โฉนด ใช้ เวลา กี่ วัน,11
บริการหักบัญชีอัตโนมัติ,จะยกเลิกคำขอการหักบัญชีอัตโนมัติ ต้องติดต่อที่ไหน,no,จะ ยกเลิก คำ ขอ การ หักบัญชี อัตโนมัติ ต้อง ติดต่อ ที่ไหน,จะ ยกเลิก คำ ขอ การ หักบัญชี อัตโนมัติ ต้อง ติดต่อ ที่ไหน,จะ ยกเลิก คำ ขอ การ หักบัญชี อัตโนมัติ ต้อง ติดต่อ ที่ไหน,11
การชำระเงิน,ขอเลขรหัสการทำรายการหน่อย,no,ขอ เลข รหัส การ ทำ รายการ หน่อย,ขอ เลข รหัส การ ทำ รายการ หน่อย,ขอ เลข รหัส การ ทำ รายการ หน่อย,11
ร้องเรียน,พี่ไม่พอใจพนักงาน จะร้องเรียนยังไง,yes,พี่ ไม่พอใจ พนักงาน จะ ร้องเรียน ยังไง,พี่ ไม่พอใจ พนักงาน จะ ร้องเรียน ยังไง,พี่ ไม่พอใจ พนักงาน จะ ร้องเรียน ยังไง,11
สำเนาใบแจ้งยอด,ต้องการสำเนาใบแจ้งยอดติดต่อไหนได้บ้าง,no,ต้องการ สำเนา ใบแจ้งยอด ติดต่อ ไหน ได้ บ้าง,ต้องการ สำเนา ใบแจ้งยอด ติดต่อ ไหน ได้ บ้าง,ต้องการ สำเนา ใบแจ้งยอด ติดต่อ ไหน ได้ บ้าง,11
สถานะการสมัคร,ได้รับจดหมายแจ้งผลสินเชื่ออยากรู้สาเหตุที่ไม่ผ่าน,no,ได้รับ จดหมาย แจ้ง ผล สินเชื่อ อยากรู้ สาเหตุ ที่ ไม่ผ่าน,ได้รับ จดหมาย แจ้ง ผล สินเชื่อ อยากรู้ สาเหตุ ที่ ไม่ผ่าน,ได้รับ จดหมาย แจ้ง ผล สินเชื่อ อยากรู้ สาเหตุ ที่ ไม่ผ่าน,11
หนังสือรับรองดอกเบี้ย,หนังสือรับรองดอกเบี้ยบ้านส่งให้ทางไหนครับ,yes,หนังสือรับรอง ดอกเบี้ย บ้าน ส่ง ให้ ทาง ไหน ครับ,หนังสือรับรอง ดอกเบี้ย บ้าน ส่ง ให้ ทาง ไหน ครับ,หนังสือรับรอง ดอกเบี้ย บ้าน ส่ง ให้ ทาง ไหน ครับ,11
ปลดล็อค OTP,otp lock ทำไงดีครับ,no,otp lock ทำไง ดีครับ,otp lock ทำไง ดีครับ,otp lock ทำไง ดีครับ,11
อัตราแลกเปลี่ยน,รับแลกเงินสกุลอินโดบ้างไหมครับ,yes,รับ แลก เงิน สกุล อินโด บ้าง ไหม ครับ,รับ แลก เงิน สกุล อินโด บ้าง ไหมครับ,รับ แลก เงิน สกุล อินโด บ้าง ไหมครับ,11
ประเภทบัญชีเงินฝาก,อยากทราบข้อมูลเงินฝากแต่ละประเภท,yes,อยาก ทราบ ข้อมูล เงินฝาก แต่ละ ประเภท,อยาก ทราบ ข้อมูล เงินฝาก แต่ละ ประเภท,อยาก ทราบ ข้อมูล เงินฝาก แต่ละ ประเภท,11
บริการเกี่ยวกับเช็ค(cheque),ตรวจสอบสถานะแคชเชียร์เช็คหน่อยครับ,yes,ตรวจสอบ สถานะ แคชเชียร์ เช็ค หน่อย ครับ,ตรวจสอบ สถานะ แคชเชียร์ เช็ค หน่อย ครับ,ตรวจสอบ สถานะ แคชเชียร์ เช็ค หน่อย ครับ,11
การรับเช็ค(cheque),กรุงศรีโรบินสันศรีราชา รับแคชเชียร์เช็คกี่โมงครับ,yes,กรุงศรี โรบินสัน ศรีราชา รับ แคชเชียร์ เช็ค กี่โมง ครับ,กรุงศรี โรบินสัน ศรีราชา รับ แคชเชียร์ เช็ค กี่โมง ครับ,กรุงศรี โรบินสัน ศรีราชา รับ แคชเชียร์ เช็ค กี่โมง ครับ,11
บริการโอนเงินต่างประเทศผ่านระบบ SWIFT,ขอทราบรหัสเพื่อโอน swift กรุงศรี,yes,ขอ ทราบ รหัส เพื่อ โอน swift กรุงศรี,ขอ ทราบ รหัส เพื่อ โอน swift กรุงศรี,ขอ ทราบ รหัส เพื่อ โอน swift กรุงศรี,11
ร่วมงานกับเรา,ต้องการร่วมงานกับกรุงศรี,yes,ต้องการ ร่วม งาน กับ กรุงศรี,ต้องการ ร่วม งาน กับ กรุงศรี,ต้องการ ร่วม งาน กับ กรุงศรี,11
สถานะการจัดส่งเอกสาร,ทำไมเอกสารช้ามาก ทำเรื่องไปนานละเนี่ย,no,ทำไม เอกสาร ช้า มาก ทำเรื่อง ไป นาน ละ เนี่ย,ทำไม เอกสาร ช้า มาก ทำเรื่อง ไป นาน ละ เนี่ย,ทำไม เอกสาร ช้า มาก ทำเรื่อง ไป นาน ละ เนี่ย,11
สอบถาม cheque clearing,ทำ clearing cheque แต่ละสาขาถึงกี่โมง,yes,ทำ clearing cheque แต่ละ สาขา ถึง กี่โมง,ทำ clearing cheque แต่ละ สาขา ถึง กี่โมง,ทำ clearing cheque แต่ละ สาขา ถึง กี่โมง,12
สอบถามการ claim ประกัน,เคมแล้วไม่เข้า,no,เคม แล้ว ไม่ เข้า,เคม แล้ว ไม่ เข้า,เคม แล้ว ไม่ เข้า,12
สอบถามค่าธรรมเนียม,ขอติดต่อสอบถามค่าธรรมเนียมสินเชื่อค่ะ,yes,ขอ ติดต่อสอบถาม ค่าธรรมเนียม สินเชื่อ ค่ะ,ขอ ติดต่อสอบถาม ค่าธรรมเนียม สินเชื่อ ค่ะ,ขอ ติดต่อสอบถาม ค่าธรรมเนียม สินเชื่อ ค่ะ,12
สอบถามการโอนเงินไปต่างประเทศ,วิธีการโอนเงินต่างประเทศทำยังไง,yes,วิธีการ โอนเงิน ต่างประเทศ ทำ ยังไง,วิธีการ โอนเงิน ต่างประเทศ ทำ ยังไง,วิธีการ โอนเงิน ต่างประเทศ ทำ ยังไง,12
สอบถามการเปิดบัญชี,เปิดบัญชีที่ atm ได้ไหมค่ะ,yes,เปิดบัญชี ที่ atm ได้ไหม ค่ะ,เปิดบัญชี ที่ atm ได้ ไหมค่ะ,เปิดบัญชี ที่ atm ได้ ไหมค่ะ,12
สอบถามการสมัคร promptpay,เงื่อนไขการสมัครพร้อมเพย์มีอะไรบ้างค่ะ,yes,เงื่อนไข การ สมัคร พร้อม เพย์ มี อะไร บ้าง ค่ะ,เงื่อนไข การ สมัคร promptpay มีอะไรบ้าง ค่ะ,เงื่อนไข การ สมัคร promptpay มีอะไรบ้าง ค่ะ,12
สอบถามข้อมูลสาขา,อยากทราบสาขากรุงศรีแถวประชาอุทิศค่ะ,yes,อยาก ทราบ สาขา กรุงศรี แถว ประชาอุทิศ ค่ะ,อยาก ทราบ สาขา กรุงศรี แถว ประชาอุทิศ ค่ะ,อยาก ทราบ สาขา กรุงศรี แถว ประชาอุทิศ ค่ะ,12
ตรวจสอบสถานะการจัดส่งบัตร,เอกสานของบัดส่งไปย๋ง,yes,เอก สาน ของ บัด ส่ง ไป ย ๋ ง,เอกสาร ของ บัด ส่ง ไป ยัง,เอกสาร ของ บัด ส่ง ไป ยัง,12
ต้องการหนังสือรับรองการหักภาษี ณ ที่จ่าย,vpkdwfhหนังสือรับรองการหักภาษี ณ ที่จ่าย,yes,vpkdwfh หนังสือรับรอง การ หัก ภาษี ณ ที่ จ่าย,vpkdwfh หนังสือรับรอง การ หัก ภาษี ณ ที่ จ่าย,vpkdwfh หนังสือรับรอง การ หัก ภาษี ณ ที่ จ่าย,12
บัตรหมดอายุ,บัตรหมดอายุเดือนหน้า ไปต่ออายุเดือนนี้ได้เลยไหม,no,บัตร หมดอายุ เดือนหน้า ไป ต่ออายุ เดือนนี้ ได้เลย ไหม,บัตร หมดอายุ เดือนหน้า ไป ต่ออายุ เดือนนี้ ได้ เลยไหม,บัตร หมดอายุ เดือนหน้า ไป ต่ออายุ เดือนนี้ ได้ เลยไหม,12
เปลี่ยนแปลงหมายเลขโทรศัพท์,เปลี่ยนแปลงข้อมูลเบอร์โทรศัพท์ สามารถโทร call center ได้ไหม หรือ จะให้ติดต่อที่ธนาคารที่สาขาที่เราเปิด,yes,เปลี่ยนแปลง ข้อมูล เบอร์โทรศัพท์ สามารถ โทร call center ได้ไหม หรือ จะ ให้ ติดต่อ ที่ ธนาคาร ที่ สาขา ที่ เรา เปิด,เปลี่ยนแปลง ข้อมูล เบอร์โทรศัพท์ สามารถ โทร call center ได้ไหม หรือ จะ ให้ ติดต่อ ที่ ธนาคาร ที่ สาขา ที่ เรา เปิด,เปลี่ยนแปลง ข้อมูล เบอร์โทรศัพท์ สามารถ โทร call center ได้ไหม หรือ จะ ให้ ติดต่อ ที่ ธนาคาร ที่ สาขา ที่ เรา เปิด,12
สอบถาม cheque,ค่าธรรมเนียมซื้อดร้าฟท์คิดอย่างไร แล้วคนรับเอาไปฝากเข้าบัญชีไม่เสียfeeใช่ป่ะ,yes,ค่าธรรมเนียม ซื้อ ดร้า ฟ ท ์ คิด อย่างไร แล้ว คนรับ เอา ไป ฝาก เข้าบัญชี ไม่ เสีย fee ใช่ ป่ะ,ค่าธรรมเนียม ซื้อ ดร้า ฟ ท ์ คิด อย่างไร แล้ว คนรับ เอา ไป ฝาก เข้าบัญชี ไม่ เสีย fee ใช่ ป่ะ,ค่าธรรมเนียม ซื้อ ดร้า ฟ ท ์ คิด อย่างไร แล้ว คนรับ เอา ไป ฝาก เข้าบัญชี ไม่ เสีย fee ใช่ ป่ะ,12
เจ้าของบัญชีเสียชีวิต,พระมรณภาพจะปิดบัญชีทำอย่างไร,yes,พระ มรณภาพ จะ ปิดบัญชี ทำ อย่างไร,พระ มรณภาพ จะ ปิดบัญชี ทำอย่างไร,พระ มรณภาพ จะ ปิดบัญชี ทำอย่างไร,12
สอบถามหมายเลขโทรศัพท์ call center,อยู่ตจว.โทร1572 ต้องกด02 ไหม,yes,อยู่ ตจว. โทร #### ต้อง กด ## ไหม,อยู่ ตจว. โทร #### ต้อง กด ## ไหม,อยู่ ตจว. โทร #### ต้อง กด ## ไหม,12
สอบถาม swift code,ขอ swift code กรุงศรี,no,ขอ swift code กรุงศรี,ขอ swift code กรุงศรี,ขอ swift code กรุงศรี,12
สอบถามการต่อประกัน,ต่อประกันทำอย่างไร,no,ต่อ ประกัน ทำ อย่างไร,ต่อ ประกัน ทำอย่างไร,ต่อ ประกัน ทำอย่างไร,12
สอบถามค่าธรรมเนียมการโอนเงิน,โอนเงินไปลาวเสียค่าธรรมเนียมเท่าใด,yes,โอนเงิน ไปลาว เสียค่าธรรมเนียม เท่าใด,โอนเงิน ไปลาว เสียค่าธรรมเนียม เท่าใด,โอนเงิน ไปลาว เสียค่าธรรมเนียม เท่าใด,12
ข้อมูลผลิตภัณฑ์ประเภทประกัน,ประกันคุ้มครองมือถือมีด้วยหรือคะ อยากทรายรายละเอียด,yes,ประกัน คุ้มครอง มือถือ มี ด้วย หรือคะ อยาก ทราย รายละเอียด,ประกัน คุ้มครอง มือถือ มี ด้วย หรือคะ อยาก ทราย รายละเอียด,ประกัน คุ้มครอง มือถือ มี ด้วย หรือคะ อยาก ทราย รายละเอียด,12
สอบถามการติดตั้ง mobile app,ขอลิงค์โหลดแอพด้วยครับ,no,ขอ ลิงค์ โหลด แอพ ด้วย ครับ,ขอ ลิงค์ โหลด_app ด้วย ครับ,ขอ ลิงค์ โหลด_app ด้วย ครับ,12
คุณสมบัติผู้สมัคร,กู้เงินได้ต้องมีเงินเดือนเท่าไร,yes,กู้ เงินได้ ต้อง มี เงินเดือน เท่าไร,กู้ เงินได้ ต้อง มี เงินเดือน เท่าไร,กู้ เงินได้ ต้อง มี เงินเดือน เท่าไร,12
ไถ่ถอนหลักประกัน,ใช้หนี้หมดแล้ว ธนาคารจะไปไถ่ถอนโฉนดให้ไหม,yes,ใช้ หนี้ หมดแล้ว ธนาคาร จะ ไป ไถ่ถอน โฉนด ให้ ไหม,ใช้ หนี้ หมดแล้ว ธนาคาร จะ ไป ไถ่ถอน โฉนด ให้ ไหม,ใช้ หนี้ หมดแล้ว ธนาคาร จะ ไป ไถ่ถอน โฉนด ให้ ไหม,12
เงินในบัญชีหาย,ยอดเงินในบัญชีหาย แจ้งที่ใคร,no,ยอดเงิน ใน บัญชี หาย แจ้ง ที่ ใคร,ยอดเงิน ใน บัญชี หาย แจ้ง ที่ ใคร,ยอดเงิน ใน บัญชี หาย แจ้ง ที่ ใคร,12
